GO:0010476,34,12,  RGA1, PIL5, GP ALPHA 1, GAMMA-TIP, GID1A, MYB65, SPY, MYB57, RGL2, MYB21, MYB0, GID1B, GA1, GA20OX1, CGA1, MYB33, GASA4, RGL3, GA3, GID1C, MYB24, SLY2, GNC, LFY, SHI, PIF3, ZFP5, GAI, GA3OX1, ATARCA, RGL1, ZFP6, GASA6, GA2,,,,,,,,,,,,,,,,,,,,,,,,,,,,,,,,,,,,,,,,,,,,,,,,,,,,,,,,,,,,,,,,,,,,,,,,,,,,,,,,,,,,,,,,,,,,,,,,,,,,,,,,,,,,,,,,,,,,,,,,,,,,,,,,,,,,,,,,,,,,,,,,,,,,,,,,,,,,,,,,,,,,,,,,,,,,,,,,,,,,,,,,,,,,,,,,,,,,,,,,,,,,,,,,,,,,,,,,,,,,,,,,,,,,,,,,,,,,,,,,,,,,,,,,,,,,,,,,,,,,,,,,,,,,,,,,,,,,,,,,,,,,,,,,,,,,,,,,,,,,,,,,,,,,,,,,,,,,,,,,,,,,,,,,,,,,,,,,,,,,,,,,,,,,,,,,,,,,,,,,,,,,,,,,,,,,,,,,,,,,,,,,,,,,,,,,,
GO:0071370,36,12,  RGA1, PIL5, GP ALPHA 1, GAMMA-TIP, GID1A, MYB65, SPY, MYB57, RGL2, MYB21, MYB0, GID1B, GA1, GA20OX1, CGA1, MYB33, GASA4, RGL3, GA3, GID1C, MYB24, SLY2, GNC, LFY, SHI, PIF3, ZFP5, ATBETAFRUCT4, GAI, GA3OX1, ATARCA, AT1G62660, RGL1, ZFP6, GASA6, GA2,,,,,,,,,,,,,,,,,,,,,,,,,,,,,,,,,,,,,,,,,,,,,,,,,,,,,,,,,,,,,,,,,,,,,,,,,,,,,,,,,,,,,,,,,,,,,,,,,,,,,,,,,,,,,,,,,,,,,,,,,,,,,,,,,,,,,,,,,,,,,,,,,,,,,,,,,,,,,,,,,,,,,,,,,,,,,,,,,,,,,,,,,,,,,,,,,,,,,,,,,,,,,,,,,,,,,,,,,,,,,,,,,,,,,,,,,,,,,,,,,,,,,,,,,,,,,,,,,,,,,,,,,,,,,,,,,,,,,,,,,,,,,,,,,,,,,,,,,,,,,,,,,,,,,,,,,,,,,,,,,,,,,,,,,,,,,,,,,,,,,,,,,,,,,,,,,,,,,,,,,,,,,,,,,,,,,,,,,,,,,,,,,,,,,,,
GO:0009740,30,12,  RGA1, PIL5, GP ALPHA 1, GAMMA-TIP, MYB65, SPY, MYB57, RGL2, MYB21, MYB0, GA1, GA20OX1, CGA1, MYB33, GASA4, RGL3, GA3, MYB24, SLY2, GNC, LFY, SHI, PIF3, ZFP5, GAI, GA3OX1, RGL1, ZFP6, GASA6, GA2,,,,,,,,,,,,,,,,,,,,,,,,,,,,,,,,,,,,,,,,,,,,,,,,,,,,,,,,,,,,,,,,,,,,,,,,,,,,,,,,,,,,,,,,,,,,,,,,,,,,,,,,,,,,,,,,,,,,,,,,,,,,,,,,,,,,,,,,,,,,,,,,,,,,,,,,,,,,,,,,,,,,,,,,,,,,,,,,,,,,,,,,,,,,,,,,,,,,,,,,,,,,,,,,,,,,,,,,,,,,,,,,,,,,,,,,,,,,,,,,,,,,,,,,,,,,,,,,,,,,,,,,,,,,,,,,,,,,,,,,,,,,,,,,,,,,,,,,,,,,,,,,,,,,,,,,,,,,,,,,,,,,,,,,,,,,,,,,,,,,,,,,,,,,,,,,,,,,,,,,,,,,,,,,,,,,,,,,,,,,,,,,,,,,,,,,,,,,,
GO:0071396,116,12,  RGA1, BRL2, SERK4, CPK6, ACO1, PIL5, GP ALPHA 1, AT2G30720, SKdZeta, ATX1, GAMMA-TIP, COI1, ABI4, ORS1, TTL3, MPK6, ARL, CB5-C, GID1A, AIF1, MYB65, SPY, DGD1, AT3G14260, AT3G15356, PLDALPHA1, MYB57, RGL2, KIN10, NTMC2T5.2, MYB21, MYB0, HERK1, SOS5, ROP10, DWF4, AT3G55310, BRH1, GID1B, TT8, AT4G17480, CBL1, BSK3, GA1, SPHK1, GA20OX1, CGA1, YUC8, BRS1, BSK1, ROC1, BRI1, MYB33, MYB29, BIM1, GASA4, RGL3, MS1, AT5G22460, GA3, GID1C, MYB24, BSK8, SLY2, UF3GT, THE1, GNC, TTL, PLC1, BSK5, LFY, FCLY, SAL1, SHI, SNRK2.3, GSK1, PIF3, ZFP5, AT1G12010, ATBETAFRUCT4, GAI, LPP2, ABCG40, GA3OX1, ATARCA, AT1G18460, JAZ1, BES1, JMT, LEC1, BSU1, GRF10, AT1G22610, RCN1, BSK4, ABCC5, EFE, AT1G28600, MYC2, AT1G33700, SERK2, GCR1, ACO2, AT1G62660, RGL1, ZFP6, SERK1, ABCG25, AT1G73920, BS1, GASA6, BZR1, AT1G77420, GRF2, GA2, SPHK2,,,,,,,,,,,,,,,,,,,,,,,,,,,,,,,,,,,,,,,,,,,,,,,,,,,,,,,,,,,,,,,,,,,,,,,,,,,,,,,,,,,,,,,,,,,,,,,,,,,,,,,,,,,,,,,,,,,,,,,,,,,,,,,,,,,,,,,,,,,,,,,,,,,,,,,,,,,,,,,,,,,,,,,,,,,,,,,,,,,,,,,,,,,,,,,,,,,,,,,,,,,,,,,,,,,,,,,,,,,,,,,,,,,,,,,,,,,,,,,,,,,,,,,,,,,,,,,,,,,,,,,,,,,,,,,,,,,,,,,,,,,,,,,,,,,,,,,,,,,,,,,,,,,,,,,
GO:0006661,28,13,  AT2G01690, PI4K GAMMA 7, SETH1, PGP1, PI4K GAMMA 4, AT3G07140, AT3G07180, AT3G14205, VTC4, AT3G01380, AT3G57170, PIPK10, AT4G35530, PIS2, PI-4KBETA2, PNT1, HL, PI-4KBETA1, AT1G12730, PIP5K1, ATSAC1, PIPK11, IMPL1, ATPI4K ALPHA, AT1G51040, AT1G61280, AT1G63110, PIS1,,,,,,,,,,,,,,,,,,,,,,,,,,,,,,,,,,,,,,,,,,,,,,,,,,,,,,,,,,,,,,,,,,,,,,,,,,,,,,,,,,,,,,,,,,,,,,,,,,,,,,,,,,,,,,,,,,,,,,,,,,,,,,,,,,,,,,,,,,,,,,,,,,,,,,,,,,,,,,,,,,,,,,,,,,,,,,,,,,,,,,,,,,,,,,,,,,,,,,,,,,,,,,,,,,,,,,,,,,,,,,,,,,,,,,,,,,,,,,,,,,,,,,,,,,,,,,,,,,,,,,,,,,,,,,,,,,,,,,,,,,,,,,,,,,,,,,,,,,,,,,,,,,,,,,,,,,,,,,,,,,,,,,,,,,,,,,,,,,,,,,,,,,,,,,,,,,,,,,,,,,,,,,,,,,,,,,,,,,,,,,,,,,,,,,,,,,,,,,,
GO:0046854,13,13,  PI4K GAMMA 7, PI4K GAMMA 4, AT3G14205, VTC4, PIPK10, HL, PI-4KBETA1, PIP5K1, ATSAC1, PIPK11, IMPL1, ATPI4K ALPHA, AT1G51040,,,,,,,,,,,,,,,,,,,,,,,,,,,,,,,,,,,,,,,,,,,,,,,,,,,,,,,,,,,,,,,,,,,,,,,,,,,,,,,,,,,,,,,,,,,,,,,,,,,,,,,,,,,,,,,,,,,,,,,,,,,,,,,,,,,,,,,,,,,,,,,,,,,,,,,,,,,,,,,,,,,,,,,,,,,,,,,,,,,,,,,,,,,,,,,,,,,,,,,,,,,,,,,,,,,,,,,,,,,,,,,,,,,,,,,,,,,,,,,,,,,,,,,,,,,,,,,,,,,,,,,,,,,,,,,,,,,,,,,,,,,,,,,,,,,,,,,,,,,,,,,,,,,,,,,,,,,,,,,,,,,,,,,,,,,,,,,,,,,,,,,,,,,,,,,,,,,,,,,,,,,,,,,,,,,,,,,,,,,,,,,,,,,,,,,,,,,,,,,,,,,,,,,,,,,,,,
GO:0030497,9,14,  KCS8, KCS13, KCS14, AAE15, KCS16, KCS17, KCS18, KCS1, ACC1,,,,,,,,,,,,,,,,,,,,,,,,,,,,,,,,,,,,,,,,,,,,,,,,,,,,,,,,,,,,,,,,,,,,,,,,,,,,,,,,,,,,,,,,,,,,,,,,,,,,,,,,,,,,,,,,,,,,,,,,,,,,,,,,,,,,,,,,,,,,,,,,,,,,,,,,,,,,,,,,,,,,,,,,,,,,,,,,,,,,,,,,,,,,,,,,,,,,,,,,,,,,,,,,,,,,,,,,,,,,,,,,,,,,,,,,,,,,,,,,,,,,,,,,,,,,,,,,,,,,,,,,,,,,,,,,,,,,,,,,,,,,,,,,,,,,,,,,,,,,,,,,,,,,,,,,,,,,,,,,,,,,,,,,,,,,,,,,,,,,,,,,,,,,,,,,,,,,,,,,,,,,,,,,,,,,,,,,,,,,,,,,,,,,,,,,,,,,,,,,,,,,,,,,,,,,,,,,,,
ath04626,32,14,  SERK4, KCS8, KCS9, CPK6, CPK16, KCS10, KCS11, KCS12, AT2G30740, MPK6, KCS13, KCS14, RIN4, MYB30, NOA1, EDS1, KCS15, HCD1, KCS16, KCS17, KCS18, KCS19, KCS20, KCS21, KCS3, KCS4, KCS5, KCS1, KCS2, KCS6, KCS7, NHO1,,,,,,,,,,,,,,,,,,,,,,,,,,,,,,,,,,,,,,,,,,,,,,,,,,,,,,,,,,,,,,,,,,,,,,,,,,,,,,,,,,,,,,,,,,,,,,,,,,,,,,,,,,,,,,,,,,,,,,,,,,,,,,,,,,,,,,,,,,,,,,,,,,,,,,,,,,,,,,,,,,,,,,,,,,,,,,,,,,,,,,,,,,,,,,,,,,,,,,,,,,,,,,,,,,,,,,,,,,,,,,,,,,,,,,,,,,,,,,,,,,,,,,,,,,,,,,,,,,,,,,,,,,,,,,,,,,,,,,,,,,,,,,,,,,,,,,,,,,,,,,,,,,,,,,,,,,,,,,,,,,,,,,,,,,,,,,,,,,,,,,,,,,,,,,,,,,,,,,,,,,,,,,,,,,,,,,,,,,,,,,,,,,,,,,,,,,,
ath00100,30,15,  CAS1, LIP1, SQE2, 3BETAHSD/D2, CYP710A4, SMO2-2, CYP710A2, CYP710A1, AT2G43420, AT3G02590, DWF1, LAS1, FK, SDP1-LIKE, SMO1-1, SMO1-2, SQS1, SQE3, SDP1, SMT1, SQP1, SQE6, SMO2-1, CYP51G1, SMT2, 3BETAHSD/D1, DWF5, XF1, SMT3, AT4G22755,,,,,,,,,,,,,,,,,,,,,,,,,,,,,,,,,,,,,,,,,,,,,,,,,,,,,,,,,,,,,,,,,,,,,,,,,,,,,,,,,,,,,,,,,,,,,,,,,,,,,,,,,,,,,,,,,,,,,,,,,,,,,,,,,,,,,,,,,,,,,,,,,,,,,,,,,,,,,,,,,,,,,,,,,,,,,,,,,,,,,,,,,,,,,,,,,,,,,,,,,,,,,,,,,,,,,,,,,,,,,,,,,,,,,,,,,,,,,,,,,,,,,,,,,,,,,,,,,,,,,,,,,,,,,,,,,,,,,,,,,,,,,,,,,,,,,,,,,,,,,,,,,,,,,,,,,,,,,,,,,,,,,,,,,,,,,,,,,,,,,,,,,,,,,,,,,,,,,,,,,,,,,,,,,,,,,,,,,,,,,,,,,,,,,,,,,,,,,
GO:0006694,29,15,  HMG2, SQE2, CYP710A4, SMO2-2, CYP710A2, CYP710A1, DET2, BEN1, CYP90D1, DWF1, BR6OX2, DWF4, FK, SMO1-1, SMO1-2, SQS1, ROT3, SQE3, SMT1, CYP724A1, SQP1, SQE6, BR6OX1, CYP51G1, SMT2, DWF5, XF1, SMT3, HMG1,,,,,,,,,,,,,,,,,,,,,,,,,,,,,,,,,,,,,,,,,,,,,,,,,,,,,,,,,,,,,,,,,,,,,,,,,,,,,,,,,,,,,,,,,,,,,,,,,,,,,,,,,,,,,,,,,,,,,,,,,,,,,,,,,,,,,,,,,,,,,,,,,,,,,,,,,,,,,,,,,,,,,,,,,,,,,,,,,,,,,,,,,,,,,,,,,,,,,,,,,,,,,,,,,,,,,,,,,,,,,,,,,,,,,,,,,,,,,,,,,,,,,,,,,,,,,,,,,,,,,,,,,,,,,,,,,,,,,,,,,,,,,,,,,,,,,,,,,,,,,,,,,,,,,,,,,,,,,,,,,,,,,,,,,,,,,,,,,,,,,,,,,,,,,,,,,,,,,,,,,,,,,,,,,,,,,,,,,,,,,,,,,,,,,,,,,,,,,,
GO:0016125,26,15,  HMG2, SQE2, CYP710A4, SMO2-2, CYP710A2, CYP710A1, SGT, ASAT1, FK, ARV2, SMO1-1, LOI1, SMO1-2, SQS1, SQE3, SMT1, SQP1, SQE6, CYP51G1, SMT2, PSAT1, UGT80B1, DWF5, XF1, SMT3, HMG1,,,,,,,,,,,,,,,,,,,,,,,,,,,,,,,,,,,,,,,,,,,,,,,,,,,,,,,,,,,,,,,,,,,,,,,,,,,,,,,,,,,,,,,,,,,,,,,,,,,,,,,,,,,,,,,,,,,,,,,,,,,,,,,,,,,,,,,,,,,,,,,,,,,,,,,,,,,,,,,,,,,,,,,,,,,,,,,,,,,,,,,,,,,,,,,,,,,,,,,,,,,,,,,,,,,,,,,,,,,,,,,,,,,,,,,,,,,,,,,,,,,,,,,,,,,,,,,,,,,,,,,,,,,,,,,,,,,,,,,,,,,,,,,,,,,,,,,,,,,,,,,,,,,,,,,,,,,,,,,,,,,,,,,,,,,,,,,,,,,,,,,,,,,,,,,,,,,,,,,,,,,,,,,,,,,,,,,,,,,,,,,,,,,,,,,,,,,,,,,,,
GO:0016126,20,15,  HMG2, SQE2, CYP710A4, SMO2-2, CYP710A2, CYP710A1, FK, SMO1-1, SMO1-2, SQS1, SQE3, SMT1, SQP1, SQE6, CYP51G1, SMT2, DWF5, XF1, SMT3, HMG1,,,,,,,,,,,,,,,,,,,,,,,,,,,,,,,,,,,,,,,,,,,,,,,,,,,,,,,,,,,,,,,,,,,,,,,,,,,,,,,,,,,,,,,,,,,,,,,,,,,,,,,,,,,,,,,,,,,,,,,,,,,,,,,,,,,,,,,,,,,,,,,,,,,,,,,,,,,,,,,,,,,,,,,,,,,,,,,,,,,,,,,,,,,,,,,,,,,,,,,,,,,,,,,,,,,,,,,,,,,,,,,,,,,,,,,,,,,,,,,,,,,,,,,,,,,,,,,,,,,,,,,,,,,,,,,,,,,,,,,,,,,,,,,,,,,,,,,,,,,,,,,,,,,,,,,,,,,,,,,,,,,,,,,,,,,,,,,,,,,,,,,,,,,,,,,,,,,,,,,,,,,,,,,,,,,,,,,,,,,,,,,,,,,,,,,,,,,,,,,,,,,,,,,
GO:0046434,31,16,  AT2G01900, NPC2, 5PTase14, CVL1, AT2G37440, GLY1, GPDHC1, 5PTase12, PLDP2, AT3G07690, VTC4, NPC5, NPC4, NPC6, AT4G05090, PLDGAMMA2, IP5PII, AT4G19860, AT5G04980, AT5G09290, GPDHp, HL, SAL1, AT5G63990, SAL2, BST1, CVP2, 5PTASE13, IP5PI, PLDEPSILON, AT1G71710,,,,,,,,,,,,,,,,,,,,,,,,,,,,,,,,,,,,,,,,,,,,,,,,,,,,,,,,,,,,,,,,,,,,,,,,,,,,,,,,,,,,,,,,,,,,,,,,,,,,,,,,,,,,,,,,,,,,,,,,,,,,,,,,,,,,,,,,,,,,,,,,,,,,,,,,,,,,,,,,,,,,,,,,,,,,,,,,,,,,,,,,,,,,,,,,,,,,,,,,,,,,,,,,,,,,,,,,,,,,,,,,,,,,,,,,,,,,,,,,,,,,,,,,,,,,,,,,,,,,,,,,,,,,,,,,,,,,,,,,,,,,,,,,,,,,,,,,,,,,,,,,,,,,,,,,,,,,,,,,,,,,,,,,,,,,,,,,,,,,,,,,,,,,,,,,,,,,,,,,,,,,,,,,,,,,,,,,,,,,,,,,,,,,,,,,,,,,
GO:0043647,28,16,  AT2G01900, MIPS2, 5PTase14, CVL1, AT2G37440, 5PTase12, ITPK4, VTC4, AT4G05090, AT4G08170, IP5PII, AT4G33770, MIPS1, AT5G04980, AT5G09290, ITPK1, IPK1, HL, AT5G60760, IPK2BETA, SAL1, AT5G63990, SAL2, BST1, CVP2, 5PTASE13, IP5PI, AT1G71710,,,,,,,,,,,,,,,,,,,,,,,,,,,,,,,,,,,,,,,,,,,,,,,,,,,,,,,,,,,,,,,,,,,,,,,,,,,,,,,,,,,,,,,,,,,,,,,,,,,,,,,,,,,,,,,,,,,,,,,,,,,,,,,,,,,,,,,,,,,,,,,,,,,,,,,,,,,,,,,,,,,,,,,,,,,,,,,,,,,,,,,,,,,,,,,,,,,,,,,,,,,,,,,,,,,,,,,,,,,,,,,,,,,,,,,,,,,,,,,,,,,,,,,,,,,,,,,,,,,,,,,,,,,,,,,,,,,,,,,,,,,,,,,,,,,,,,,,,,,,,,,,,,,,,,,,,,,,,,,,,,,,,,,,,,,,,,,,,,,,,,,,,,,,,,,,,,,,,,,,,,,,,,,,,,,,,,,,,,,,,,,,,,,,,,,,,,,,,,,
GO:0046174,21,16,  AT2G01900, 5PTase14, CVL1, AT2G37440, 5PTase12, SDP6, VTC4, AT4G05090, IP5PII, AT5G04980, AT5G09290, HL, SAL1, AT5G63990, SAL2, BST1, CVP2, 5PTASE13, IP5PI, AT1G71710, NHO1,,,,,,,,,,,,,,,,,,,,,,,,,,,,,,,,,,,,,,,,,,,,,,,,,,,,,,,,,,,,,,,,,,,,,,,,,,,,,,,,,,,,,,,,,,,,,,,,,,,,,,,,,,,,,,,,,,,,,,,,,,,,,,,,,,,,,,,,,,,,,,,,,,,,,,,,,,,,,,,,,,,,,,,,,,,,,,,,,,,,,,,,,,,,,,,,,,,,,,,,,,,,,,,,,,,,,,,,,,,,,,,,,,,,,,,,,,,,,,,,,,,,,,,,,,,,,,,,,,,,,,,,,,,,,,,,,,,,,,,,,,,,,,,,,,,,,,,,,,,,,,,,,,,,,,,,,,,,,,,,,,,,,,,,,,,,,,,,,,,,,,,,,,,,,,,,,,,,,,,,,,,,,,,,,,,,,,,,,,,,,,,,,,,,,,,,,,,,,,,,,,,,,,
GO:0046855,19,16,  AT2G01900, 5PTase14, CVL1, AT2G37440, 5PTase12, VTC4, AT4G05090, IP5PII, AT5G04980, AT5G09290, HL, SAL1, AT5G63990, SAL2, BST1, CVP2, 5PTASE13, IP5PI, AT1G71710,,,,,,,,,,,,,,,,,,,,,,,,,,,,,,,,,,,,,,,,,,,,,,,,,,,,,,,,,,,,,,,,,,,,,,,,,,,,,,,,,,,,,,,,,,,,,,,,,,,,,,,,,,,,,,,,,,,,,,,,,,,,,,,,,,,,,,,,,,,,,,,,,,,,,,,,,,,,,,,,,,,,,,,,,,,,,,,,,,,,,,,,,,,,,,,,,,,,,,,,,,,,,,,,,,,,,,,,,,,,,,,,,,,,,,,,,,,,,,,,,,,,,,,,,,,,,,,,,,,,,,,,,,,,,,,,,,,,,,,,,,,,,,,,,,,,,,,,,,,,,,,,,,,,,,,,,,,,,,,,,,,,,,,,,,,,,,,,,,,,,,,,,,,,,,,,,,,,,,,,,,,,,,,,,,,,,,,,,,,,,,,,,,,,,,,,,,,,,,,,,,,,,,,,
GO:0071545,19,16,  AT2G01900, 5PTase14, CVL1, AT2G37440, 5PTase12, VTC4, AT4G05090, IP5PII, AT5G04980, AT5G09290, HL, SAL1, AT5G63990, SAL2, BST1, CVP2, 5PTASE13, IP5PI, AT1G71710,,,,,,,,,,,,,,,,,,,,,,,,,,,,,,,,,,,,,,,,,,,,,,,,,,,,,,,,,,,,,,,,,,,,,,,,,,,,,,,,,,,,,,,,,,,,,,,,,,,,,,,,,,,,,,,,,,,,,,,,,,,,,,,,,,,,,,,,,,,,,,,,,,,,,,,,,,,,,,,,,,,,,,,,,,,,,,,,,,,,,,,,,,,,,,,,,,,,,,,,,,,,,,,,,,,,,,,,,,,,,,,,,,,,,,,,,,,,,,,,,,,,,,,,,,,,,,,,,,,,,,,,,,,,,,,,,,,,,,,,,,,,,,,,,,,,,,,,,,,,,,,,,,,,,,,,,,,,,,,,,,,,,,,,,,,,,,,,,,,,,,,,,,,,,,,,,,,,,,,,,,,,,,,,,,,,,,,,,,,,,,,,,,,,,,,,,,,,,,,,,,,,,,,,
GO:0046164,23,16,  AT2G01900, 5PTase14, CVL1, AT2G37440, 5PTase12, SDP6, VTC4, REF6, AT4G05090, IP5PII, AT5G04980, AT5G09290, CYP707A3, HL, SAL1, AT5G63990, SAL2, BST1, CVP2, 5PTASE13, IP5PI, AT1G71710, NHO1,,,,,,,,,,,,,,,,,,,,,,,,,,,,,,,,,,,,,,,,,,,,,,,,,,,,,,,,,,,,,,,,,,,,,,,,,,,,,,,,,,,,,,,,,,,,,,,,,,,,,,,,,,,,,,,,,,,,,,,,,,,,,,,,,,,,,,,,,,,,,,,,,,,,,,,,,,,,,,,,,,,,,,,,,,,,,,,,,,,,,,,,,,,,,,,,,,,,,,,,,,,,,,,,,,,,,,,,,,,,,,,,,,,,,,,,,,,,,,,,,,,,,,,,,,,,,,,,,,,,,,,,,,,,,,,,,,,,,,,,,,,,,,,,,,,,,,,,,,,,,,,,,,,,,,,,,,,,,,,,,,,,,,,,,,,,,,,,,,,,,,,,,,,,,,,,,,,,,,,,,,,,,,,,,,,,,,,,,,,,,,,,,,,,,,,,,,,,,,,,,,,,
GO:0046856,17,16,  AT2G01900, 5PTase14, CVL1, AT2G37440, 5PTase12, PEN2, AT3G43220, IP5PII, AT5G04980, PTEN1, BST1, CVP2, 5PTASE13, IP5PI, 5PTASE11, FRA3, AT1G71710,,,,,,,,,,,,,,,,,,,,,,,,,,,,,,,,,,,,,,,,,,,,,,,,,,,,,,,,,,,,,,,,,,,,,,,,,,,,,,,,,,,,,,,,,,,,,,,,,,,,,,,,,,,,,,,,,,,,,,,,,,,,,,,,,,,,,,,,,,,,,,,,,,,,,,,,,,,,,,,,,,,,,,,,,,,,,,,,,,,,,,,,,,,,,,,,,,,,,,,,,,,,,,,,,,,,,,,,,,,,,,,,,,,,,,,,,,,,,,,,,,,,,,,,,,,,,,,,,,,,,,,,,,,,,,,,,,,,,,,,,,,,,,,,,,,,,,,,,,,,,,,,,,,,,,,,,,,,,,,,,,,,,,,,,,,,,,,,,,,,,,,,,,,,,,,,,,,,,,,,,,,,,,,,,,,,,,,,,,,,,,,,,,,,,,,,,,,,,,,,,,,,,,,,,,
GO:0046839,17,16,  AT2G01900, 5PTase14, CVL1, AT2G37440, 5PTase12, PEN2, AT3G43220, IP5PII, AT5G04980, PTEN1, BST1, CVP2, 5PTASE13, IP5PI, 5PTASE11, FRA3, AT1G71710,,,,,,,,,,,,,,,,,,,,,,,,,,,,,,,,,,,,,,,,,,,,,,,,,,,,,,,,,,,,,,,,,,,,,,,,,,,,,,,,,,,,,,,,,,,,,,,,,,,,,,,,,,,,,,,,,,,,,,,,,,,,,,,,,,,,,,,,,,,,,,,,,,,,,,,,,,,,,,,,,,,,,,,,,,,,,,,,,,,,,,,,,,,,,,,,,,,,,,,,,,,,,,,,,,,,,,,,,,,,,,,,,,,,,,,,,,,,,,,,,,,,,,,,,,,,,,,,,,,,,,,,,,,,,,,,,,,,,,,,,,,,,,,,,,,,,,,,,,,,,,,,,,,,,,,,,,,,,,,,,,,,,,,,,,,,,,,,,,,,,,,,,,,,,,,,,,,,,,,,,,,,,,,,,,,,,,,,,,,,,,,,,,,,,,,,,,,,,,,,,,,,,,,,,,
GO:1901616,25,16,  AT2G01900, 5PTase14, CVL1, AT2G37440, 5PTase12, SDP6, VTC4, REF6, ASAT1, AT4G05090, IP5PII, AT5G04980, AT5G09290, CYP707A3, HL, SAL1, AT5G63990, SAL2, BST1, CVP2, 5PTASE13, PSAT1, IP5PI, AT1G71710, NHO1,,,,,,,,,,,,,,,,,,,,,,,,,,,,,,,,,,,,,,,,,,,,,,,,,,,,,,,,,,,,,,,,,,,,,,,,,,,,,,,,,,,,,,,,,,,,,,,,,,,,,,,,,,,,,,,,,,,,,,,,,,,,,,,,,,,,,,,,,,,,,,,,,,,,,,,,,,,,,,,,,,,,,,,,,,,,,,,,,,,,,,,,,,,,,,,,,,,,,,,,,,,,,,,,,,,,,,,,,,,,,,,,,,,,,,,,,,,,,,,,,,,,,,,,,,,,,,,,,,,,,,,,,,,,,,,,,,,,,,,,,,,,,,,,,,,,,,,,,,,,,,,,,,,,,,,,,,,,,,,,,,,,,,,,,,,,,,,,,,,,,,,,,,,,,,,,,,,,,,,,,,,,,,,,,,,,,,,,,,,,,,,,,,,,,,,,,,,,,,,,,,
GO:0009695,23,17,  OPR3, PKT3, ACX5, SSI2, DAD1, AOC1, AOC2, AOC3, LOX2, AT4G05160, ACX1, AIM1, AOS, DGL, AOC4, LOX3, JMT, OPCL1, LOX1, AT1G61850, LOX6, LOX4, OPR2,,,,,,,,,,,,,,,,,,,,,,,,,,,,,,,,,,,,,,,,,,,,,,,,,,,,,,,,,,,,,,,,,,,,,,,,,,,,,,,,,,,,,,,,,,,,,,,,,,,,,,,,,,,,,,,,,,,,,,,,,,,,,,,,,,,,,,,,,,,,,,,,,,,,,,,,,,,,,,,,,,,,,,,,,,,,,,,,,,,,,,,,,,,,,,,,,,,,,,,,,,,,,,,,,,,,,,,,,,,,,,,,,,,,,,,,,,,,,,,,,,,,,,,,,,,,,,,,,,,,,,,,,,,,,,,,,,,,,,,,,,,,,,,,,,,,,,,,,,,,,,,,,,,,,,,,,,,,,,,,,,,,,,,,,,,,,,,,,,,,,,,,,,,,,,,,,,,,,,,,,,,,,,,,,,,,,,,,,,,,,,,,,,,,,,,,,,,,,,,,,,,,
GO:0009694,24,17,  OPR3, PKT3, ACX5, SSI2, DAD1, AOC1, AOC2, AOC3, LOX2, AT4G05160, ACX1, AIM1, ST2A, AOS, DGL, AOC4, LOX3, JMT, OPCL1, LOX1, AT1G61850, LOX6, LOX4, OPR2,,,,,,,,,,,,,,,,,,,,,,,,,,,,,,,,,,,,,,,,,,,,,,,,,,,,,,,,,,,,,,,,,,,,,,,,,,,,,,,,,,,,,,,,,,,,,,,,,,,,,,,,,,,,,,,,,,,,,,,,,,,,,,,,,,,,,,,,,,,,,,,,,,,,,,,,,,,,,,,,,,,,,,,,,,,,,,,,,,,,,,,,,,,,,,,,,,,,,,,,,,,,,,,,,,,,,,,,,,,,,,,,,,,,,,,,,,,,,,,,,,,,,,,,,,,,,,,,,,,,,,,,,,,,,,,,,,,,,,,,,,,,,,,,,,,,,,,,,,,,,,,,,,,,,,,,,,,,,,,,,,,,,,,,,,,,,,,,,,,,,,,,,,,,,,,,,,,,,,,,,,,,,,,,,,,,,,,,,,,,,,,,,,,,,,,,,,,,,,,,,,,
GO:0031407,17,17,  OPR3, PLA2A, RD20, DGD1, FAD5, LOX5, LOX2, ATS1, AOS, ATPXG2, LOX3, JMT, LOX1, LOX6, LOX4, OPR1, OPR2,,,,,,,,,,,,,,,,,,,,,,,,,,,,,,,,,,,,,,,,,,,,,,,,,,,,,,,,,,,,,,,,,,,,,,,,,,,,,,,,,,,,,,,,,,,,,,,,,,,,,,,,,,,,,,,,,,,,,,,,,,,,,,,,,,,,,,,,,,,,,,,,,,,,,,,,,,,,,,,,,,,,,,,,,,,,,,,,,,,,,,,,,,,,,,,,,,,,,,,,,,,,,,,,,,,,,,,,,,,,,,,,,,,,,,,,,,,,,,,,,,,,,,,,,,,,,,,,,,,,,,,,,,,,,,,,,,,,,,,,,,,,,,,,,,,,,,,,,,,,,,,,,,,,,,,,,,,,,,,,,,,,,,,,,,,,,,,,,,,,,,,,,,,,,,,,,,,,,,,,,,,,,,,,,,,,,,,,,,,,,,,,,,,,,,,,,,,,,,,,,,,,,,,,,,
GO:0031408,16,17,  OPR3, PLA2A, DGD1, FAD5, LOX5, LOX2, ATS1, AOS, ATPXG2, LOX3, JMT, LOX1, LOX6, LOX4, OPR1, OPR2,,,,,,,,,,,,,,,,,,,,,,,,,,,,,,,,,,,,,,,,,,,,,,,,,,,,,,,,,,,,,,,,,,,,,,,,,,,,,,,,,,,,,,,,,,,,,,,,,,,,,,,,,,,,,,,,,,,,,,,,,,,,,,,,,,,,,,,,,,,,,,,,,,,,,,,,,,,,,,,,,,,,,,,,,,,,,,,,,,,,,,,,,,,,,,,,,,,,,,,,,,,,,,,,,,,,,,,,,,,,,,,,,,,,,,,,,,,,,,,,,,,,,,,,,,,,,,,,,,,,,,,,,,,,,,,,,,,,,,,,,,,,,,,,,,,,,,,,,,,,,,,,,,,,,,,,,,,,,,,,,,,,,,,,,,,,,,,,,,,,,,,,,,,,,,,,,,,,,,,,,,,,,,,,,,,,,,,,,,,,,,,,,,,,,,,,,,,,,,,,,,,,,,,,,,,
ath00591,9,17,  PLA2-ALPHA, LOX5, LOX2, SDP1-LIKE, SDP1, LOX3, LOX1, LOX6, LOX4,,,,,,,,,,,,,,,,,,,,,,,,,,,,,,,,,,,,,,,,,,,,,,,,,,,,,,,,,,,,,,,,,,,,,,,,,,,,,,,,,,,,,,,,,,,,,,,,,,,,,,,,,,,,,,,,,,,,,,,,,,,,,,,,,,,,,,,,,,,,,,,,,,,,,,,,,,,,,,,,,,,,,,,,,,,,,,,,,,,,,,,,,,,,,,,,,,,,,,,,,,,,,,,,,,,,,,,,,,,,,,,,,,,,,,,,,,,,,,,,,,,,,,,,,,,,,,,,,,,,,,,,,,,,,,,,,,,,,,,,,,,,,,,,,,,,,,,,,,,,,,,,,,,,,,,,,,,,,,,,,,,,,,,,,,,,,,,,,,,,,,,,,,,,,,,,,,,,,,,,,,,,,,,,,,,,,,,,,,,,,,,,,,,,,,,,,,,,,,,,,,,,,,,,,,,,,,,,,,
GO:0009395,8,18,  NPC2, PLDP2, NPC5, NPC4, NPC6, PLDGAMMA2, AT4G19860, PLDEPSILON,,,,,,,,,,,,,,,,,,,,,,,,,,,,,,,,,,,,,,,,,,,,,,,,,,,,,,,,,,,,,,,,,,,,,,,,,,,,,,,,,,,,,,,,,,,,,,,,,,,,,,,,,,,,,,,,,,,,,,,,,,,,,,,,,,,,,,,,,,,,,,,,,,,,,,,,,,,,,,,,,,,,,,,,,,,,,,,,,,,,,,,,,,,,,,,,,,,,,,,,,,,,,,,,,,,,,,,,,,,,,,,,,,,,,,,,,,,,,,,,,,,,,,,,,,,,,,,,,,,,,,,,,,,,,,,,,,,,,,,,,,,,,,,,,,,,,,,,,,,,,,,,,,,,,,,,,,,,,,,,,,,,,,,,,,,,,,,,,,,,,,,,,,,,,,,,,,,,,,,,,,,,,,,,,,,,,,,,,,,,,,,,,,,,,,,,,,,,,,,,,,,,,,,,,,,,,,,,,,,
GO:0042761,14,19,  ADS2, AT3G23840, LAG1, MYB30, PAS1, AT4G13840, CER2, PAS2, CYP86B1, BI1, ADS1, LAG13, KCS1, KCR1,,,,,,,,,,,,,,,,,,,,,,,,,,,,,,,,,,,,,,,,,,,,,,,,,,,,,,,,,,,,,,,,,,,,,,,,,,,,,,,,,,,,,,,,,,,,,,,,,,,,,,,,,,,,,,,,,,,,,,,,,,,,,,,,,,,,,,,,,,,,,,,,,,,,,,,,,,,,,,,,,,,,,,,,,,,,,,,,,,,,,,,,,,,,,,,,,,,,,,,,,,,,,,,,,,,,,,,,,,,,,,,,,,,,,,,,,,,,,,,,,,,,,,,,,,,,,,,,,,,,,,,,,,,,,,,,,,,,,,,,,,,,,,,,,,,,,,,,,,,,,,,,,,,,,,,,,,,,,,,,,,,,,,,,,,,,,,,,,,,,,,,,,,,,,,,,,,,,,,,,,,,,,,,,,,,,,,,,,,,,,,,,,,,,,,,,,,,,,,,,,,,,,,,,,,,,,
GO:0030148,20,20,  AT2G19880, AtIPCS3, AtIPCS2, SLD2, TSC10A, LOH2, LAG1, SPT1, AtIPCS1, SLD1, DES-1-LIKE, ATCES1, LCB1, TSC10B, LCBK1, LCB2, LAG13, SBH2, SBH1, AT1G26200,,,,,,,,,,,,,,,,,,,,,,,,,,,,,,,,,,,,,,,,,,,,,,,,,,,,,,,,,,,,,,,,,,,,,,,,,,,,,,,,,,,,,,,,,,,,,,,,,,,,,,,,,,,,,,,,,,,,,,,,,,,,,,,,,,,,,,,,,,,,,,,,,,,,,,,,,,,,,,,,,,,,,,,,,,,,,,,,,,,,,,,,,,,,,,,,,,,,,,,,,,,,,,,,,,,,,,,,,,,,,,,,,,,,,,,,,,,,,,,,,,,,,,,,,,,,,,,,,,,,,,,,,,,,,,,,,,,,,,,,,,,,,,,,,,,,,,,,,,,,,,,,,,,,,,,,,,,,,,,,,,,,,,,,,,,,,,,,,,,,,,,,,,,,,,,,,,,,,,,,,,,,,,,,,,,,,,,,,,,,,,,,,,,,,,,,,,,,,,,,,,,,,,,
ath00600,22,20,  AT2G38010, TSC10A, AT3G24180, SPT1, AT3G56310, DES-1-LIKE, AT4G10060, SPHK1, ATCES1, LCB1, AGAL1, TSC10B, LCB2, AT5G49900, ACD5, AT5G58980, AT1G07380, SBH2, DPL1, AT1G33700, SBH1, SPHK2,,,,,,,,,,,,,,,,,,,,,,,,,,,,,,,,,,,,,,,,,,,,,,,,,,,,,,,,,,,,,,,,,,,,,,,,,,,,,,,,,,,,,,,,,,,,,,,,,,,,,,,,,,,,,,,,,,,,,,,,,,,,,,,,,,,,,,,,,,,,,,,,,,,,,,,,,,,,,,,,,,,,,,,,,,,,,,,,,,,,,,,,,,,,,,,,,,,,,,,,,,,,,,,,,,,,,,,,,,,,,,,,,,,,,,,,,,,,,,,,,,,,,,,,,,,,,,,,,,,,,,,,,,,,,,,,,,,,,,,,,,,,,,,,,,,,,,,,,,,,,,,,,,,,,,,,,,,,,,,,,,,,,,,,,,,,,,,,,,,,,,,,,,,,,,,,,,,,,,,,,,,,,,,,,,,,,,,,,,,,,,,,,,,,,,,,,,,,,,,,,,,,,
GO:0006672,12,20,  AT2G19880, LOH2, AT3G24180, LAG1, AT4G10060, ATCES1, AT5G49900, ACD5, AT1G07380, LAG13, AT1G33700, AT1G26200,,,,,,,,,,,,,,,,,,,,,,,,,,,,,,,,,,,,,,,,,,,,,,,,,,,,,,,,,,,,,,,,,,,,,,,,,,,,,,,,,,,,,,,,,,,,,,,,,,,,,,,,,,,,,,,,,,,,,,,,,,,,,,,,,,,,,,,,,,,,,,,,,,,,,,,,,,,,,,,,,,,,,,,,,,,,,,,,,,,,,,,,,,,,,,,,,,,,,,,,,,,,,,,,,,,,,,,,,,,,,,,,,,,,,,,,,,,,,,,,,,,,,,,,,,,,,,,,,,,,,,,,,,,,,,,,,,,,,,,,,,,,,,,,,,,,,,,,,,,,,,,,,,,,,,,,,,,,,,,,,,,,,,,,,,,,,,,,,,,,,,,,,,,,,,,,,,,,,,,,,,,,,,,,,,,,,,,,,,,,,,,,,,,,,,,,,,,,,,,,,,,,,,,,,,,,,,,
GO:0046513,5,20,  AT2G19880, LOH2, LAG1, LAG13, AT1G26200,,,,,,,,,,,,,,,,,,,,,,,,,,,,,,,,,,,,,,,,,,,,,,,,,,,,,,,,,,,,,,,,,,,,,,,,,,,,,,,,,,,,,,,,,,,,,,,,,,,,,,,,,,,,,,,,,,,,,,,,,,,,,,,,,,,,,,,,,,,,,,,,,,,,,,,,,,,,,,,,,,,,,,,,,,,,,,,,,,,,,,,,,,,,,,,,,,,,,,,,,,,,,,,,,,,,,,,,,,,,,,,,,,,,,,,,,,,,,,,,,,,,,,,,,,,,,,,,,,,,,,,,,,,,,,,,,,,,,,,,,,,,,,,,,,,,,,,,,,,,,,,,,,,,,,,,,,,,,,,,,,,,,,,,,,,,,,,,,,,,,,,,,,,,,,,,,,,,,,,,,,,,,,,,,,,,,,,,,,,,,,,,,,,,,,,,,,,,,,,,,,,,,,,,,,,,,,,,,,,,,,
ath00565,26,18,  PLA2-ALPHA, NPC2, PLDBETA1, AT2G45670, PLDP2, PLDALPHA1, PLDP1, NPC5, NPC4, NPC6, SDP1-LIKE, AAPT2, PLDBETA2, PLDGAMMA2, PLDGAMMA3, PLDGAMMA1, PLDDELTA, SDP1, PLDALPHA3, NPC1, LPLAT1, AAPT1, PLDALPHA2, PLDEPSILON, LPLAT2, AT1G80950,,,,,,,,,,,,,,,,,,,,,,,,,,,,,,,,,,,,,,,,,,,,,,,,,,,,,,,,,,,,,,,,,,,,,,,,,,,,,,,,,,,,,,,,,,,,,,,,,,,,,,,,,,,,,,,,,,,,,,,,,,,,,,,,,,,,,,,,,,,,,,,,,,,,,,,,,,,,,,,,,,,,,,,,,,,,,,,,,,,,,,,,,,,,,,,,,,,,,,,,,,,,,,,,,,,,,,,,,,,,,,,,,,,,,,,,,,,,,,,,,,,,,,,,,,,,,,,,,,,,,,,,,,,,,,,,,,,,,,,,,,,,,,,,,,,,,,,,,,,,,,,,,,,,,,,,,,,,,,,,,,,,,,,,,,,,,,,,,,,,,,,,,,,,,,,,,,,,,,,,,,,,,,,,,,,,,,,,,,,,,,,,,,,,,,,,,,,,,,,,,
ath00062,35,14,  KCS8, KCS9, KCS10, KCS11, KCS12, KCS13, KCS14, AT3G45770, KCS15, CER10, AT3G60340, AT4G17470, AT4G17480, AT4G17483, KCS16, KCS17, KCS18, KCS19, PAS2, KCS20, AT5G47330, AT5G47340, AT5G47350, KCS21, AT5G59770, KCS3, KCS4, KCR2, KCS5, AT1G01710, KCS1, KCS2, KCR1, KCS6, KCS7,,,,,,,,,,,,,,,,,,,,,,,,,,,,,,,,,,,,,,,,,,,,,,,,,,,,,,,,,,,,,,,,,,,,,,,,,,,,,,,,,,,,,,,,,,,,,,,,,,,,,,,,,,,,,,,,,,,,,,,,,,,,,,,,,,,,,,,,,,,,,,,,,,,,,,,,,,,,,,,,,,,,,,,,,,,,,,,,,,,,,,,,,,,,,,,,,,,,,,,,,,,,,,,,,,,,,,,,,,,,,,,,,,,,,,,,,,,,,,,,,,,,,,,,,,,,,,,,,,,,,,,,,,,,,,,,,,,,,,,,,,,,,,,,,,,,,,,,,,,,,,,,,,,,,,,,,,,,,,,,,,,,,,,,,,,,,,,,,,,,,,,,,,,,,,,,,,,,,,,,,,,,,,,,,,,,,,,,,,,,,,,,,,,,,,,,
ath01212,63,6,  LACS8, AT2G04540, MOD1, AT2G22230, EMB3147, PKT3, ACX5, CAC3, SSI2, LACS1, LACS6, AT3G06690, MFP2, FAD2, AT3G02610, AT3G02620, AT3G02630, AAE13, AAE16, AT3G45770, ACX4, CER10, AT3G60340, AT4G11030, AAE15, ACX1, AT4G17470, AT4G17480, AT4G17483, LACS4, AIM1, AT5G10160, PAS2, BCCP2, AT5G16230, AT5G16240, CAC1, LACS7, CAC2, KASI, AT5G47330, AT5G47340, AT5G47350, AACT1, KAT5, AT5G59770, ACX2, ACX3, ACX6, FATB, AT1G24360, KCR2, PKT4, ACC1, ACC2, FTM1, LACS2, KAS III, LACS3, KCR1, FAB1, LACS9, accD,,,,,,,,,,,,,,,,,,,,,,,,,,,,,,,,,,,,,,,,,,,,,,,,,,,,,,,,,,,,,,,,,,,,,,,,,,,,,,,,,,,,,,,,,,,,,,,,,,,,,,,,,,,,,,,,,,,,,,,,,,,,,,,,,,,,,,,,,,,,,,,,,,,,,,,,,,,,,,,,,,,,,,,,,,,,,,,,,,,,,,,,,,,,,,,,,,,,,,,,,,,,,,,,,,,,,,,,,,,,,,,,,,,,,,,,,,,,,,,,,,,,,,,,,,,,,,,,,,,,,,,,,,,,,,,,,,,,,,,,,,,,,,,,,,,,,,,,,,,,,,,,,,,,,,,,,,,,,,,,,,,,,,,,,,,,,,,,,,,,,,,,,,,,,,,,,,,,,,,,,,,,
ath00561,56,9,  PAP1, MGDC, DGK3, TAG1, DGK5, AKR4C10, GPAT6, SFR2, PAH1, GPAT5, DGD1, NPC3, LPP3, LPP4, LPAT5, AT3G44830, DGAT2, UGP3, AT3G56310, SDP1-LIKE, LPAT2, GPAT3, DGD2, GPAT8, GPP1, DGK6, DGK7, ATS2, MGD1, SQD1, SDP1, GPAT7, DGK1, AGAL1, PDAT, SQD2, MGD2, PAH2, GS1, DGK4, DGK2, GPAT1, AT1G11090, LPLAT1, LPP2, AT1G18360, GPAT4, GPAT2, ATS1, DGAT3, LPAT3, ALDH7B4, LPLAT2, AT1G73480, LPAT4, NHO1,,,,,,,,,,,,,,,,,,,,,,,,,,,,,,,,,,,,,,,,,,,,,,,,,,,,,,,,,,,,,,,,,,,,,,,,,,,,,,,,,,,,,,,,,,,,,,,,,,,,,,,,,,,,,,,,,,,,,,,,,,,,,,,,,,,,,,,,,,,,,,,,,,,,,,,,,,,,,,,,,,,,,,,,,,,,,,,,,,,,,,,,,,,,,,,,,,,,,,,,,,,,,,,,,,,,,,,,,,,,,,,,,,,,,,,,,,,,,,,,,,,,,,,,,,,,,,,,,,,,,,,,,,,,,,,,,,,,,,,,,,,,,,,,,,,,,,,,,,,,,,,,,,,,,,,,,,,,,,,,,,,,,,,,,,,,,,,,,,,,,,,,,,,,,,,,,,,,,,,,,,,,,,,,,,,
ath00562,68,5,  MIPS2, PIP5K3, NPC2, AT2G40116, PIP5K5, ITPK4, PIP5K6, PLC2, PIP5K9, MTM1, AT3G14205, FAB1B, VTC4, NPC5, NPC4, PEN2, AT3G43220, NPC6, PEN3, RHD4, SAC8, AT3G55940, PIP5K4, AT4G08170, IP5PII, PIPK10, FAB1A, AT4G33770, PLC1, PIS2, IMPL2, MIPS1, MTM2, IPK2a, AT5G09290, PI-4KBETA2, MIPS3, ITPK1, AT5G20840, PTEN1, IPK1, PLC1, PLC5, PLC4, IPK2BETA, SAL1, AT5G63990, SAL2, PI-4KBETA1, ATSAC1B, NPC1, AT1G10900, AT1G17340, PIP5K1, AT1G22100, ATSAC1, PIPK11, IMPL1, IP5PI, FAB1D, ATPI4K ALPHA, AT1G51040, AT1G58643, VPS34, AT1G60890, PIS1, FAB1C, PIP5K2,,,,,,,,,,,,,,,,,,,,,,,,,,,,,,,,,,,,,,,,,,,,,,,,,,,,,,,,,,,,,,,,,,,,,,,,,,,,,,,,,,,,,,,,,,,,,,,,,,,,,,,,,,,,,,,,,,,,,,,,,,,,,,,,,,,,,,,,,,,,,,,,,,,,,,,,,,,,,,,,,,,,,,,,,,,,,,,,,,,,,,,,,,,,,,,,,,,,,,,,,,,,,,,,,,,,,,,,,,,,,,,,,,,,,,,,,,,,,,,,,,,,,,,,,,,,,,,,,,,,,,,,,,,,,,,,,,,,,,,,,,,,,,,,,,,,,,,,,,,,,,,,,,,,,,,,,,,,,,,,,,,,,,,,,,,,,,,,,,,,,,,,,,,,,,,,,,,,,,,
ath00900,54,8,  ISPD, HMG2, cPT1, AT2G18620, GGPS4, AT2G23400, CPT, GGPS2, CDPMEK, GPS1, FACE2, AT3G14510, AT3G14530, GGPS3, IPP2, ICME-LIKE2, AT3G20160, DXPS1, AT3G29430, AT3G32040, AT3G54250, FTA, HMGS, CLA1, FPS2, ATSTE24, HDR, GGR, ATSTE14B, DXPS3, PCME, IPP1, STE14A, MK, ERA1, AACT1, FPS1, FOLK, cPT4, cPT5, cPT6, AT5G58784, cPT8, cPT9, HDS, FCLY, SPS2, ICME-LIKE1, GGPS6, ISPF, AT1G74470, HMG1, SPS1, LEW1,,,,,,,,,,,,,,,,,,,,,,,,,,,,,,,,,,,,,,,,,,,,,,,,,,,,,,,,,,,,,,,,,,,,,,,,,,,,,,,,,,,,,,,,,,,,,,,,,,,,,,,,,,,,,,,,,,,,,,,,,,,,,,,,,,,,,,,,,,,,,,,,,,,,,,,,,,,,,,,,,,,,,,,,,,,,,,,,,,,,,,,,,,,,,,,,,,,,,,,,,,,,,,,,,,,,,,,,,,,,,,,,,,,,,,,,,,,,,,,,,,,,,,,,,,,,,,,,,,,,,,,,,,,,,,,,,,,,,,,,,,,,,,,,,,,,,,,,,,,,,,,,,,,,,,,,,,,,,,,,,,,,,,,,,,,,,,,,,,,,,,,,,,,,,,,,,,,,,,,,,,,,,,,,,,,,,
ath00592,35,17,  OPR3, PLA2-ALPHA, PKT3, ACX5, DAD1, AT3G06690, MFP2, DOX1, LCAT3, AOC1, AOC2, AOC3, LOX2, ACX4, SDP1-LIKE, ACX1, AT4G19860, AIM1, SDP1, AOS, KAT5, ACX2, ACX3, ACX6, AT1G09400, AOC4, LOX3, JMT, OPCL1, PKT4, LOX6, LOX4, ALPHA DOX2, OPR1, OPR2,,,,,,,,,,,,,,,,,,,,,,,,,,,,,,,,,,,,,,,,,,,,,,,,,,,,,,,,,,,,,,,,,,,,,,,,,,,,,,,,,,,,,,,,,,,,,,,,,,,,,,,,,,,,,,,,,,,,,,,,,,,,,,,,,,,,,,,,,,,,,,,,,,,,,,,,,,,,,,,,,,,,,,,,,,,,,,,,,,,,,,,,,,,,,,,,,,,,,,,,,,,,,,,,,,,,,,,,,,,,,,,,,,,,,,,,,,,,,,,,,,,,,,,,,,,,,,,,,,,,,,,,,,,,,,,,,,,,,,,,,,,,,,,,,,,,,,,,,,,,,,,,,,,,,,,,,,,,,,,,,,,,,,,,,,,,,,,,,,,,,,,,,,,,,,,,,,,,,,,,,,,,,,,,,,,,,,,,,,,,,,,,,,,,,,,,
